{
  "fixture_version": 1,
  "profile": "LICHESS_ANTICHESS_V1",
  "authority_lock": "RULES/AUTHORITY.lock.json",
  "field_authority": {
    "valid_position_fen_and_complete_legal_moves": [
      "scalachess:cbffc9d7e2c6f8ba33381c5403e1b4f992199626",
      "chessops:736c40ced7130d453d85e7979c360b797474c9a7"
    ],
    "history_and_automatic_results": [
      "scalachess:cbffc9d7e2c6f8ba33381c5403e1b4f992199626",
      "lila:13895e5856db0f854f6ab76394fffce852ebd5c9"
    ],
    "one_sided_cannot_win_and_service_results": [
      "scalachess:cbffc9d7e2c6f8ba33381c5403e1b4f992199626",
      "lila:13895e5856db0f854f6ab76394fffce852ebd5c9"
    ],
    "malformed_fen_policy": [
      "project_fail_closed_boundary",
      "chessops:736c40ced7130d453d85e7979c360b797474c9a7"
    ],
    "limitations": [
      "chessops does not reconstruct repetition history from a lone FEN",
      "chessops halfmove counters are not used here as an automatic fifty-move referee",
      "chessops color-specific insufficient-material methods are not substituted for lila service predicates"
    ]
  },
  "position_fixtures": [
    {
      "id": "initial_position",
      "family": "identity",
      "fen": "rnbqkbnr/pppppppp/8/8/8/8/PPPPPPPP/RNBQKBNR w - - 0 1",
      "input_policy": "accept",
      "expected": {
        "canonical_fen": "rnbqkbnr/pppppppp/8/8/8/8/PPPPPPPP/RNBQKBNR w - - 0 1",
        "legal_moves": ["a2a3", "a2a4", "b1a3", "b1c3", "b2b3", "b2b4", "c2c3", "c2c4", "d2d3", "d2d4", "e2e3", "e2e4", "f2f3", "f2f4", "g1f3", "g1h3", "g2g3", "g2g4", "h2h3", "h2h4"],
        "end": false,
        "automatic_draw": false,
        "threefold": false,
        "fivefold": false,
        "variant_end": false,
        "status": null,
        "winner": null,
        "check": false,
        "player_insufficient": false,
        "opponent_insufficient": false,
        "halfmove_clock": 0,
        "effective_ep": null
      }
    },
    {
      "id": "mandatory_capture_single",
      "family": "mandatory_capture",
      "fen": "8/8/8/3p4/4P3/8/8/8 w - - 0 1",
      "input_policy": "accept",
      "expected": {
        "canonical_fen": "8/8/8/3p4/4P3/8/8/8 w - - 0 1",
        "legal_moves": ["e4d5"],
        "end": false,
        "automatic_draw": false,
        "threefold": false,
        "fivefold": false,
        "variant_end": false,
        "status": null,
        "winner": null,
        "check": false,
        "player_insufficient": false,
        "opponent_insufficient": false,
        "halfmove_clock": 0,
        "effective_ep": null
      }
    },
    {
      "id": "mandatory_capture_free_choice",
      "family": "mandatory_capture",
      "fen": "8/8/8/2p1p3/3B4/8/8/8 w - - 0 1",
      "input_policy": "accept",
      "expected": {
        "canonical_fen": "8/8/8/2p1p3/3B4/8/8/8 w - - 0 1",
        "legal_moves": ["d4c5", "d4e5"],
        "end": false,
        "automatic_draw": false,
        "threefold": false,
        "fivefold": false,
        "variant_end": false,
        "status": null,
        "winner": null,
        "check": false,
        "player_insufficient": false,
        "opponent_insufficient": false,
        "halfmove_clock": 0,
        "effective_ep": null
      }
    },
    {
      "id": "king_ignores_rook_attack",
      "family": "nonroyal_king",
      "fen": "4r3/8/8/8/8/8/8/4K3 w - - 0 1",
      "input_policy": "accept",
      "expected": {
        "canonical_fen": "4r3/8/8/8/8/8/8/4K3 w - - 0 1",
        "legal_moves": ["e1d1", "e1d2", "e1e2", "e1f1", "e1f2"],
        "end": false,
        "automatic_draw": false,
        "threefold": false,
        "fivefold": false,
        "variant_end": false,
        "status": null,
        "winner": null,
        "check": false,
        "player_insufficient": false,
        "opponent_insufficient": false,
        "halfmove_clock": 0,
        "effective_ep": null
      }
    },
    {
      "id": "adjacent_king_capture",
      "family": "nonroyal_king",
      "fen": "8/8/8/4k3/4K3/8/8/8 w - - 0 1",
      "input_policy": "accept",
      "expected": {
        "canonical_fen": "8/8/8/4k3/4K3/8/8/8 w - - 0 1",
        "legal_moves": ["e4e5"],
        "end": false,
        "automatic_draw": false,
        "threefold": false,
        "fivefold": false,
        "variant_end": false,
        "status": null,
        "winner": null,
        "check": false,
        "player_insufficient": false,
        "opponent_insufficient": false,
        "halfmove_clock": 0,
        "effective_ep": null
      }
    },
    {
      "id": "kingless_play",
      "family": "nonroyal_king",
      "fen": "8/7p/8/8/8/8/R7/8 w - - 0 1",
      "input_policy": "accept",
      "expected": {
        "canonical_fen": "8/7p/8/8/8/8/R7/8 w - - 0 1",
        "legal_moves": ["a2a1", "a2a3", "a2a4", "a2a5", "a2a6", "a2a7", "a2a8", "a2b2", "a2c2", "a2d2", "a2e2", "a2f2", "a2g2", "a2h2"],
        "end": false,
        "automatic_draw": false,
        "threefold": false,
        "fivefold": false,
        "variant_end": false,
        "status": null,
        "winner": null,
        "check": false,
        "player_insufficient": false,
        "opponent_insufficient": false,
        "halfmove_clock": 0,
        "effective_ep": null
      }
    },
    {
      "id": "multiple_white_kings",
      "family": "nonroyal_king",
      "fen": "K3K3/8/8/8/8/8/8/7k w - - 0 1",
      "input_policy": "accept",
      "expected": {
        "canonical_fen": "K3K3/8/8/8/8/8/8/7k w - - 0 1",
        "legal_moves": ["a8a7", "a8b7", "a8b8", "e8d7", "e8d8", "e8e7", "e8f7", "e8f8"],
        "end": false,
        "automatic_draw": false,
        "threefold": false,
        "fivefold": false,
        "variant_end": false,
        "status": null,
        "winner": null,
        "check": false,
        "player_insufficient": false,
        "opponent_insufficient": false,
        "halfmove_clock": 0,
        "effective_ep": null
      }
    },
    {
      "id": "castling_text_is_stripped",
      "family": "castling",
      "fen": "r3k2r/8/8/8/8/8/P6P/R3K2R w KQkq - 0 1",
      "input_policy": "accept",
      "expected": {
        "canonical_fen": "r3k2r/8/8/8/8/8/P6P/R3K2R w - - 0 1",
        "legal_moves": ["a1b1", "a1c1", "a1d1", "a2a3", "a2a4", "e1d1", "e1d2", "e1e2", "e1f1", "e1f2", "h1f1", "h1g1", "h2h3", "h2h4"],
        "end": false,
        "automatic_draw": false,
        "threefold": false,
        "fivefold": false,
        "variant_end": false,
        "status": null,
        "winner": null,
        "check": false,
        "player_insufficient": false,
        "opponent_insufficient": false,
        "halfmove_clock": 0,
        "effective_ep": null
      }
    },
    {
      "id": "en_passant_only_capture",
      "family": "en_passant",
      "fen": "8/8/8/3pP3/8/8/8/8 w - d6 0 1",
      "input_policy": "accept",
      "expected": {
        "canonical_fen": "8/8/8/3pP3/8/8/8/8 w - d6 0 1",
        "legal_moves": ["e5d6"],
        "end": false,
        "automatic_draw": false,
        "threefold": false,
        "fivefold": false,
        "variant_end": false,
        "status": null,
        "winner": null,
        "check": false,
        "player_insufficient": false,
        "opponent_insufficient": false,
        "halfmove_clock": 0,
        "effective_ep": "d6"
      }
    },
    {
      "id": "en_passant_among_captures",
      "family": "en_passant",
      "fen": "8/8/8/3pPp2/4P3/8/8/8 w - d6 0 1",
      "input_policy": "accept",
      "expected": {
        "canonical_fen": "8/8/8/3pPp2/4P3/8/8/8 w - d6 0 1",
        "legal_moves": ["e4d5", "e4f5", "e5d6"],
        "end": false,
        "automatic_draw": false,
        "threefold": false,
        "fivefold": false,
        "variant_end": false,
        "status": null,
        "winner": null,
        "check": false,
        "player_insufficient": false,
        "opponent_insufficient": false,
        "halfmove_clock": 0,
        "effective_ep": "d6"
      }
    },
    {
      "id": "ineffective_en_passant_is_stripped",
      "family": "en_passant",
      "fen": "8/7p/8/8/8/8/P7/8 w - e4 0 1",
      "input_policy": "accept",
      "expected": {
        "canonical_fen": "8/7p/8/8/8/8/P7/8 w - - 0 1",
        "legal_moves": ["a2a3", "a2a4"],
        "end": false,
        "automatic_draw": false,
        "threefold": false,
        "fivefold": false,
        "variant_end": false,
        "status": null,
        "winner": null,
        "check": false,
        "player_insufficient": false,
        "opponent_insufficient": false,
        "halfmove_clock": 0,
        "effective_ep": null
      }
    },
    {
      "id": "quiet_promotion_all_roles",
      "family": "promotion",
      "fen": "7k/P7/8/8/8/8/8/8 w - - 0 1",
      "input_policy": "accept",
      "expected": {
        "canonical_fen": "7k/P7/8/8/8/8/8/8 w - - 0 1",
        "legal_moves": ["a7a8b", "a7a8k", "a7a8n", "a7a8q", "a7a8r"],
        "end": false,
        "automatic_draw": false,
        "threefold": false,
        "fivefold": false,
        "variant_end": false,
        "status": null,
        "winner": null,
        "check": false,
        "player_insufficient": false,
        "opponent_insufficient": false,
        "halfmove_clock": 0,
        "effective_ep": null
      }
    },
    {
      "id": "capture_promotion_all_roles",
      "family": "promotion",
      "fen": "1r5k/P7/8/8/8/8/8/8 w - - 0 1",
      "input_policy": "accept",
      "expected": {
        "canonical_fen": "1r5k/P7/8/8/8/8/8/8 w - - 0 1",
        "legal_moves": ["a7b8b", "a7b8k", "a7b8n", "a7b8q", "a7b8r"],
        "end": false,
        "automatic_draw": false,
        "threefold": false,
        "fivefold": false,
        "variant_end": false,
        "status": null,
        "winner": null,
        "check": false,
        "player_insufficient": false,
        "opponent_insufficient": false,
        "halfmove_clock": 0,
        "effective_ep": null
      }
    },
    {
      "id": "side_to_move_has_no_pieces",
      "family": "terminal",